<?xml version="1.0" encoding="UTF-8" standalone="no"?><Football xmlns:xsi="http://www.w3.org/2001/XMLSchema-instance" xsi:noNamespaceSchemaLocation="football.xsd"><Team><Id>1</Id><Name>Chelsea</Name><Country>England</Country><Player><Id>1</Id><Name>Mudryk</Name><Country>Ukraine</Country><Position>LW</Position></Player><Player><Id>2</Id><Name>Silva</Name><Country>Brazil</Country><Position>CB</Position></Player><Player><Id>3</Id><Name>Sterling</Name><Country>England</Country><Position>RW</Position></Player></Team><Team><Id>2</Id><Name>Barcelona</Name><Country>Spain</Country><Player><Id>1</Id><Name>Bellingham</Name><Country>England</Country><Position>CM</Position></Player></Team></Football>